{
  "job": {
    "title": "Sales Support Executive",
    "company": "Example Trading Pte Ltd",
    "location": "Singapore",
    "source": "https://example.com/job/123"
  },
  "candidate": {
    "profile_id": "candidate-profile-v1"
  },
  "capability_profile": {
    "reasoning": 0.35,
    "planning": 0.25,
    "creativity": 0.15,
    "operational_complexity": 0.55,
    "coordination": 0.45
  },
  "evaluation": {
    "alignment_score": 0.82,
    "gap_analysis": {
      "reasoning": 0.10,
      "planning": -0.05,
      "creativity": 0.12,
      "operational_complexity": 0.00,
      "coordination": -0.08
    },
    "confidence": "HIGH"
  },
  "summary": "The job demonstrates stronger operational complexity and coordination demands. Alignment is healthy, with modest gaps in reasoning and creativity compared to candidate capabilities.",
  "metadata": {
    "evaluation_version": "1.0.0",
    "timestamp": "2026-02-28T21:00:00Z",
    "model": "gpt-5.2"
  }
}
